file,tag
images/sapporo.jpg,北海道札幌市中央区大通札幌テレビ塔
images/sapporo02.jpg,北海道札幌市中央区大通公園
images/sapporo03.jpg,北海道札幌市中央区すすきの交差点
images/sapporo04.jpg,北海道札幌市中央区大通駅前通り
images/sapporo05.jpg,北海道札幌市中央区大通南1丁目駅前通り
images/sapporo06.jpg,北海道札幌市中央区札幌駅前通り
images/sapporo07.jpg,北海道札幌市豊平区福住東月寒札幌ドーム
images/sapporo08.jpg,北海道札幌市清田区真栄
images/sapporo09.jpg,北海道札幌市白石区地下鉄白石駅前
images/sapporo10.jpg,北海道札幌市手稲区前田森林公園
images/sapporo11.jpg,北海道札幌市北区北31条北34条駅前
images/sapporo12.jpg,北海道札幌市北区北20条北18条駅前
images/sapporo13.jpg,北海道札幌市豊平区南平岸駅
images/sapporo14.jpg,北海道札幌市手稲区手稲駅前
images/sapporo15.jpg,北海道札幌市西区地下鉄琴似駅前
images/sapporo16.jpg,北海道札幌市西区JR琴似駅前
images/sapporo17.jpg,北海道札幌市手稲区手稲駅前
images/sapporo18.jpg,北海道札幌市中央区札幌駅南口夜景
images/sapporo19.jpg,北海道札幌市中央区大通公園
images/sapporo20.jpg,北海道札幌市中央区札幌駅南口
images/sapporo21.jpg,北海道札幌市中央区北1条交差点
images/sapporo22.jpg,北海道札幌市北区北18条駅前
images/sapporo23.jpg,北海道札幌市南区澄川駅前
images/sapporo24.jpg,北海道札幌市北区北24条駅前
images/sapporo25.jpg,北海道札幌市中央区札幌市役所屋上
images/sapporo26.jpg,北海道札幌市中央区大通札幌市役所屋上札幌テレビ塔
images/sapporo27.jpg,北海道札幌市東区北8条東4丁目
images/sapporo28.jpg,北海道札幌市東区
images/sapporo29.jpg,北海道札幌市東区
images/sapporo30.jpg,北海道札幌市北区札幌駅北口
images/sapporo31.jpg,北海道札幌市北区札幌駅北口
images/sapporo32.jpg,北海道札幌市中央区札幌駅前
images/sapporo33.jpg,北海道札幌市中央区札幌駅前創成側通り
images/sapporo34.jpg,北海道札幌市豊平区平岸駅前
images/hakodate.jpg,北海道函館市本町五稜真栄
images/otaru01.jpg,北海道小樽市小樽駅前
images/kusiro01.jpg,北海道釧路市幣舞橋
images/kusiro02.jpg,北海道釧路市末広町
images/obihiro01.jpg,北海道帯広市帯広駅前
images/obihiro02.jpg,北海道帯広市帯広駅前
images/obihiro03.jpg,北海道帯広市帯広駅前
images/obihiro04.jpg,北海道帯広市広小路
images/obihiro05.jpg,北海道帯広市
images/obihiro06.jpg,北海道帯広市
images/obihiro07.jpg,北海道帯広市よつ葉アリーナ
images/obihiro08.jpg,北海道帯広市十勝大橋
images/obihiro09.jpg,北海道帯広市十勝川
images/obihiro10.jpg,北海道帯広市役所
images/obihiro11.jpg,北海道帯広市広小路
images/obihiro12.jpg,北海道帯広市
images/obihiro13.jpg,北海道帯広市
images/obihiro14.jpg,北海道帯広市
images/obihiro15.jpg,北海道帯広市
images/chitose.jpg,北海道千歳市千歳駅
images/chitose02.jpg,北海道千歳市千歳駅前
images/wakkanai.jpg,北海道稚内市稚内駅
images/wakkanai02.jpg,北海道稚内市宗谷岬
images/kitahirosima01.jpg,北海道北広島市大曲
images/kitahirosima02.jpg,北海道北広島市北広島駅前
images/isikari01.jpg,北海道石狩市役所
images/otohuke01.jpg,北海道河東郡音更町
images/otohuke02.jpg,北海道河東郡音更町鈴蘭公園展望台
images/otohuke03.jpg,北海道河東郡音更町
images/otohuke04.jpg,北海道河東郡音更町
images/aomori.jpg,青森県青森市青森駅前
images/aomori02.jpg,青森県青森市観光物産館アスパム
images/aomori03.jpg,青森県青森市新町
images/senndai01.jpg,宮城県仙台市青葉区国分町
images/senndai02.jpg,宮城県仙台市青葉区アイル仙台トラストタワー
images/senndai03.jpg,宮城県仙台市青葉区仙台駅前
images/tokyo.jpg,東京都千代田区東京駅
images/tokyo02.jpg,東京都渋谷区渋谷駅
images/tokyo03.jpg,東京都渋谷区渋谷駅
images/tokyo04.jpg,東京都渋谷区渋谷駅
images/tokyo05.jpg,東京都渋谷区原宿竹下通り
images/tokyo06.jpg,東京都中央区銀座
images/tokyo07.jpg,東京都港区東京タワー夜景
images/tokyo08.jpg,東京都港区東京タワー夜景
images/tokyo09.jpg,東京都千代田区大手町
images/tokyo10.jpg,東京都千代田区丸の内東京駅前
images/tokyo11.jpg,東京都新宿区東京都庁
images/tokyo12.jpg,東京都新宿区西新宿東京都庁
images/tokyo13.jpg,東京都新宿区西新宿
images/tokyo14.jpg,東京都新宿区西新宿
images/tokyo15.jpg,東京都新宿区歌舞伎町
images/tokyo16.jpg,東京都台東区浅草雷門
images/kawasaki01.jpg,神奈川県川崎市川崎区川崎駅前
images/yokohama01.jpg,神奈川県横浜市西区横浜駅前みなとみらい
images/yokohama02.jpg,神奈川県横浜市西区横浜駅前みなとみらい
images/yokohama03.jpg,神奈川県横浜市西区みなとみらい横浜ランドマークタワー
images/yokohama04.jpg,神奈川県横浜市西区みなとみらい横浜ランドマークタワー
images/yokohama05.jpg,神奈川県横浜市西区桜木町横浜ランドマークタワー
images/yokohama06.jpg,神奈川県横浜市中区馬車道駅前
images/yokohama07.jpg,神奈川県横浜市中区日本大通り駅前
images/yokohama08.jpg,神奈川県横浜市中区横浜中華街石川町駅前
images/sizuoka01.jpg,静岡県静岡市駿河区静岡駅
images/sizuoka02.jpg,静岡県静岡市葵区
images/sizuoka03.jpg,静岡県静岡市葵区駅前通り
images/hamamatu01.jpg,静岡県浜松市中央区浜松駅前
images/hamamatu02.jpg,静岡県浜松市中央区浜松アクトタワー展望デッキ
images/hamamatu03.jpg,静岡県浜松市中央区浜松駅前
images/nagoya.jpg,愛知県名古屋市中村区名駅名古屋駅
images/nagoya02.jpg,愛知県名古屋市中区栄
images/nagoya03.jpg,愛知県名古屋市中区伏見
images/nagoya04.jpg,愛知県名古屋市中区中村区夜景
images/nagoya05.jpg,愛知県名古屋市中区久屋大通
images/nagoya06.jpg,愛知県名古屋市中村区名駅名古屋駅前
images/kyoto01.jpg,京都府京都市下京区京都駅京都タワー
images/kyoto02.jpg,京都府京都市下京区京都駅
images/kyoto03.jpg,京都府京都市下京区五条駅前
images/kyoto04.jpg,京都府京都市中京区四条烏丸
images/kyoto05.jpg,京都府京都市中京区四条河原町
images/kyoto06.jpg,京都府京都市東山区清水寺
images/kyoto07.jpg,京都府京都市
images/kyoto08.jpg,京都府京都市下京区烏丸通京都駅
images/kyoto09.jpg,京都府京都市伏見区伏見稲荷大社
images/kyoto10.jpg,京都府京都市右京区嵐山
images/kyoto11.jpg,京都府京都市右京区嵐山竹林の小径
images/kyoto12.jpg,京都府京都市北区金閣寺
images/kyoto13.jpg,京都府京都市中京区二条城
images/kyoto14.jpg,京都府京都市下京区京都駅京都タワー
images/kyoto15.jpg,京都府京都市下京区京都駅京都タワー
images/oosaka.jpg,大阪府大阪市中央区淀屋橋
images/oosaka01.jpg,大阪府大阪市天王寺区阿倍野区天王寺あべのハルカス
images/oosaka02.jpg,大阪府大阪市中央区大阪市役所
images/oosaka03.jpg,大阪府大阪市浪速区新世界通天閣あべのハルカス
images/oosaka04.jpg,大阪府大阪市天王寺区あべのハルカス
images/oosaka05.jpg,大阪府大阪市此花区USJユニバーサルシティ駅前
images/oosaka06.jpg,大阪府大阪市港区弁天町
images/oosaka07.jpg,大阪府大阪市北区梅田
images/oosaka08.jpg,大阪府大阪市北区梅田
images/oosaka09.jpg,大阪府大阪市北区梅田
images/oosaka10.jpg,大阪府大阪市北区梅田
images/oosaka11.jpg,大阪府大阪市北区梅田
images/oosaka12.jpg,大阪府大阪市北区梅田
images/oosaka13.jpg,大阪府大阪市北区梅田
images/oosaka14.jpg,大阪府大阪市北区梅田
images/oosaka15.jpg,大阪府大阪市中央区難波
images/oosaka16.jpg,大阪府大阪市中央区難波道頓堀戎橋
images/oosaka17.jpg,大阪府大阪市中央区心斎橋
images/oosaka18.jpg,大阪府大阪市中央区心斎橋
images/oosaka19.jpg,大阪府大阪市中央区本町船場
images/oosaka20.jpg,大阪府大阪市中央区心斎橋筋商店街
images/oosaka21.jpg,大阪府大阪市中央区心斎橋筋商店街
images/oosaka22.jpg,大阪府大阪市中央区本町船場
images/oosaka23.jpg,大阪府大阪市港区海遊館
images/nara01.jpg,奈良県奈良市東大寺
images/nara02.jpg,奈良県奈良市東大寺奈良の大仏
images/kobe.jpg,兵庫県神戸市中央区三宮
images/kobe02.jpg,兵庫県神戸市中央区三宮元町
images/kobe03.jpg,兵庫県神戸市中央区ポートタワー
images/kobe04.jpg,兵庫県神戸市中央区ポートタワーハーバーランド
images/simonoseki01.jpg,山口県下関市下関駅前海峡ゆめタワー
images/kitakyuusyuu01.jpg,福岡県北九州市小倉駅北区小倉駅前
images/kitakyuusyuu02.jpg,福岡県北九州市八幡西区黒崎駅前
images/kitakyuusyuu03.jpg,福岡県北九州市小倉駅北区小倉駅前
images/kitakyuusyuu04.jpg,福岡県北九州市門司区門司港駅前門司港レトロ
images/kitakyuusyuu05.jpg,福岡県北九州市八幡東区八幡駅前
images/kitakyuusyuu06.jpg,福岡県北九州市八幡西区折尾駅前
images/fukuoka01.jpg,福岡県福岡市博多区博多駅前
images/fukuoka02.jpg,福岡県福岡市中央区天神南駅前
images/fukuoka03.jpg,福岡県福岡市早良区福岡タワー
images/fukuoka04.jpg,福岡県福岡市西区姪浜駅前
images/fukuoka05.jpg,福岡県福岡市博多区中洲川端駅前
images/fukuoka06.jpg,福岡県福岡市早良区福岡タワー夜景
images/fukuoka07.jpg,福岡県福岡市早良区福岡タワー夜景
images/fukuoka08.jpg,福岡県福岡市早良区福岡タワー夜景
images/fukuoka09.jpg,福岡県福岡市東区アイランドシティー
images/fukuoka10.jpg,福岡県福岡市南区大橋駅前


